{"schema_version":1,"scope":"Reviewed coarse candidate-model trajectory; not a recipe or accepted fill model.","case_id":"baa7937cf12fbec9","model":"CopperSuppressionFill quasi-steady suppressor-access proxy","model_controls":{"active_deposition_rate":0.2,"adsorption_strength":0.1,"deactivation_rate":0.25,"gas_mean_free_path":-1.0,"suppressed_deposition_rate":0.01,"suppressor_source_power":1.0,"suppressor_sticking_probability":0.2},"numerics":{"checkpoint_interval":0.05,"disk_radius":0.0,"grid_delta":0.01,"max_boundary_hits":1000,"max_duration":14.0,"max_reflections":100,"min_node_distance_factor":0.05,"rays_per_point":1000,"save_every":20,"smoothing_neighbors":1,"threads_per_worker":1,"time_step_ratio":0.4999},"target":{"barrier_seed_min_conformality":0.985,"barrier_seed_min_thickness":0.012,"liner_min_conformality":0.995,"liner_min_thickness":0.02,"max_balance_error":1e-10,"min_overburden":0.15},"target_basis":{"barrier_seed_min_conformality":{"classification":"assumed_study_target","physical_qualification":false,"source":{"path":"program.md","sha256":"57e46850e8435253e826b119f5b2ea00021c9b7a643896f42698f8d990f315a4","section":"Step comparison and handoff rules"}},"barrier_seed_min_thickness":{"classification":"assumed_study_target","physical_qualification":false,"source":{"path":"program.md","sha256":"57e46850e8435253e826b119f5b2ea00021c9b7a643896f42698f8d990f315a4","section":"Step comparison and handoff rules"}},"liner_min_conformality":{"classification":"assumed_study_target","physical_qualification":false,"source":{"path":"program.md","sha256":"57e46850e8435253e826b119f5b2ea00021c9b7a643896f42698f8d990f315a4","section":"Step comparison and handoff rules"}},"liner_min_thickness":{"classification":"assumed_study_target","physical_qualification":false,"source":{"path":"program.md","sha256":"57e46850e8435253e826b119f5b2ea00021c9b7a643896f42698f8d990f315a4","section":"Step comparison and handoff rules"}},"max_balance_error":{"classification":"implementation_assumption","physical_qualification":false,"source":{"path":"foundation_copper_fill_structural_challenge.py","sha256":"d0864bd5a93f10899ce746127e9c52f2a2a97e01cb3c11f2fa808c52bca66500","section":"candidate_case"}},"min_overburden":{"classification":"assumed_study_target","physical_qualification":false,"source":{"path":"program.md","sha256":"57e46850e8435253e826b119f5b2ea00021c9b7a643896f42698f8d990f315a4","section":"Step comparison and handoff rules"}}},"view_box":[-0.5,-0.25,1.0,1.85],"starting_materials":[{"id":"silicon","surface_path":"M-0.15000 -1.25000L-0.14000 -1.25000M-0.14000 -1.25000L-0.13000 -1.25000M-0.13000 -1.25000L-0.12000 -1.25000M-0.12000 -1.25000L-0.11000 -1.25000M-0.11000 -1.25000L-0.10000 -1.25000M-0.10000 -1.25000L-0.09000 -1.25000M-0.09000 -1.25000L-0.08000 -1.25000M-0.08000 -1.25000L-0.07000 -1.25000M-0.07000 -1.25000L-0.06000 -1.25000M-0.06000 -1.25000L-0.05000 -1.25000M-0.05000 -1.25000L-0.04000 -1.25000M-0.04000 -1.25000L-0.03000 -1.25000M-0.03000 -1.25000L-0.02000 -1.25000M-0.02000 -1.25000L-0.01000 -1.25000M-0.01000 -1.25000L0.00000 -1.25000M0.00000 -1.25000L0.01000 -1.25000M0.01000 -1.25000L0.02000 -1.25000M0.02000 -1.25000L0.03000 -1.25000M0.03000 -1.25000L0.04000 -1.25000M0.04000 -1.25000L0.05000 -1.25000M0.05000 -1.25000L0.06000 -1.25000M0.06000 -1.25000L0.07000 -1.25000M0.07000 -1.25000L0.08000 -1.25000M0.08000 -1.25000L0.09000 -1.25000M0.09000 -1.25000L0.10000 -1.25000M0.10000 -1.25000L0.11000 -1.25000M0.11000 -1.25000L0.12000 -1.25000M0.12000 -1.25000L0.13000 -1.25000M0.13000 -1.25000L0.14000 -1.25000M0.14000 -1.25000L0.15000 -1.25000M-0.15000 -1.24000L-0.15000 -1.25000M0.15000 -1.25000L0.15000 -1.24000M-0.15000 -1.23000L-0.15000 -1.24000M0.15000 -1.24000L0.15000 -1.23000M-0.15000 -1.22000L-0.15000 -1.23000M0.15000 -1.23000L0.15000 -1.22000M-0.15000 -1.21000L-0.15000 -1.22000M0.15000 -1.22000L0.15000 -1.21000M-0.15000 -1.20000L-0.15000 -1.21000M0.15000 -1.21000L0.15000 -1.20000M-0.15000 -1.19000L-0.15000 -1.20000M0.15000 -1.20000L0.15000 -1.19000M-0.15000 -1.18000L-0.15000 -1.19000M0.15000 -1.19000L0.15000 -1.18000M-0.15000 -1.17000L-0.15000 -1.18000M0.15000 -1.18000L0.15000 -1.17000M-0.15000 -1.16000L-0.15000 -1.17000M0.15000 -1.17000L0.15000 -1.16000M-0.15000 -1.15000L-0.15000 -1.16000M0.15000 -1.16000L0.15000 -1.15000M-0.15000 -1.14000L-0.15000 -1.15000M0.15000 -1.15000L0.15000 -1.14000M-0.15000 -1.13000L-0.15000 -1.14000M0.15000 -1.14000L0.15000 -1.13000M-0.15000 -1.12000L-0.15000 -1.13000M0.15000 -1.13000L0.15000 -1.12000M-0.15000 -1.11000L-0.15000 -1.12000M0.15000 -1.12000L0.15000 -1.11000M-0.15000 -1.10000L-0.15000 -1.11000M0.15000 -1.11000L0.15000 -1.10000M-0.15000 -1.09000L-0.15000 -1.10000M0.15000 -1.10000L0.15000 -1.09000M-0.15000 -1.08000L-0.15000 -1.09000M0.15000 -1.09000L0.15000 -1.08000M-0.15000 -1.07000L-0.15000 -1.08000M0.15000 -1.08000L0.15000 -1.07000M-0.15000 -1.06000L-0.15000 -1.07000M0.15000 -1.07000L0.15000 -1.06000M-0.15000 -1.05000L-0.15000 -1.06000M0.15000 -1.06000L0.15000 -1.05000M-0.15000 -1.04000L-0.15000 -1.05000M0.15000 -1.05000L0.15000 -1.04000M-0.15000 -1.03000L-0.15000 -1.04000M0.15000 -1.04000L0.15000 -1.03000M-0.15000 -1.02000L-0.15000 -1.03000M0.15000 -1.03000L0.15000 -1.02000M-0.15000 -1.01000L-0.15000 -1.02000M0.15000 -1.02000L0.15000 -1.01000M-0.15000 -1.00000L-0.15000 -1.01000M0.15000 -1.01000L0.15000 -1.00000M-0.15000 -0.99000L-0.15000 -1.00000M0.15000 -1.00000L0.15000 -0.99000M-0.15000 -0.98000L-0.15000 -0.99000M0.15000 -0.99000L0.15000 -0.98000M-0.15000 -0.97000L-0.15000 -0.98000M0.15000 -0.98000L0.15000 -0.97000M-0.15000 -0.96000L-0.15000 -0.97000M0.15000 -0.97000L0.15000 -0.96000M-0.15000 -0.95000L-0.15000 -0.96000M0.15000 -0.96000L0.15000 -0.95000M-0.15000 -0.94000L-0.15000 -0.95000M0.15000 -0.95000L0.15000 -0.94000M-0.15000 -0.93000L-0.15000 -0.94000M0.15000 -0.94000L0.15000 -0.93000M-0.15000 -0.92000L-0.15000 -0.93000M0.15000 -0.93000L0.15000 -0.92000M-0.15000 -0.91000L-0.15000 -0.92000M0.15000 -0.92000L0.15000 -0.91000M-0.15000 -0.90000L-0.15000 -0.91000M0.15000 -0.91000L0.15000 -0.90000M-0.15000 -0.89000L-0.15000 -0.90000M0.15000 -0.90000L0.15000 -0.89000M-0.15000 -0.88000L-0.15000 -0.89000M0.15000 -0.89000L0.15000 -0.88000M-0.15000 -0.87000L-0.15000 -0.88000M0.15000 -0.88000L0.15000 -0.87000M-0.15000 -0.86000L-0.15000 -0.87000M0.15000 -0.87000L0.15000 -0.86000M-0.15000 -0.85000L-0.15000 -0.86000M0.15000 -0.86000L0.15000 -0.85000M-0.15000 -0.84000L-0.15000 -0.85000M0.15000 -0.85000L0.15000 -0.84000M-0.15000 -0.83000L-0.15000 -0.84000M0.15000 -0.84000L0.15000 -0.83000M-0.15000 -0.82000L-0.15000 -0.83000M0.15000 -0.83000L0.15000 -0.82000M-0.15000 -0.81000L-0.15000 -0.82000M0.15000 -0.82000L0.15000 -0.81000M-0.15000 -0.80000L-0.15000 -0.81000M0.15000 -0.81000L0.15000 -0.80000M-0.15000 -0.79000L-0.15000 -0.80000M0.15000 -0.80000L0.15000 -0.79000M-0.15000 -0.78000L-0.15000 -0.79000M0.15000 -0.79000L0.15000 -0.78000M-0.15000 -0.77000L-0.15000 -0.78000M0.15000 -0.78000L0.15000 -0.77000M-0.15000 -0.76000L-0.15000 -0.77000M0.15000 -0.77000L0.15000 -0.76000M-0.15000 -0.75000L-0.15000 -0.76000M0.15000 -0.76000L0.15000 -0.75000M-0.15000 -0.74000L-0.15000 -0.75000M0.15000 -0.75000L0.15000 -0.74000M-0.15000 -0.73000L-0.15000 -0.74000M0.15000 -0.74000L0.15000 -0.73000M-0.15000 -0.72000L-0.15000 -0.73000M0.15000 -0.73000L0.15000 -0.72000M-0.15000 -0.71000L-0.15000 -0.72000M0.15000 -0.72000L0.15000 -0.71000M-0.15000 -0.70000L-0.15000 -0.71000M0.15000 -0.71000L0.15000 -0.70000M-0.15000 -0.69000L-0.15000 -0.70000M0.15000 -0.70000L0.15000 -0.69000M-0.15000 -0.68000L-0.15000 -0.69000M0.15000 -0.69000L0.15000 -0.68000M-0.15000 -0.67000L-0.15000 -0.68000M0.15000 -0.68000L0.15000 -0.67000M-0.15000 -0.66000L-0.15000 -0.67000M0.15000 -0.67000L0.15000 -0.66000M-0.15000 -0.65000L-0.15000 -0.66000M0.15000 -0.66000L0.15000 -0.65000M-0.15000 -0.64000L-0.15000 -0.65000M0.15000 -0.65000L0.15000 -0.64000M-0.15000 -0.63000L-0.15000 -0.64000M0.15000 -0.64000L0.15000 -0.63000M-0.15000 -0.62000L-0.15000 -0.63000M0.15000 -0.63000L0.15000 -0.62000M-0.15000 -0.61000L-0.15000 -0.62000M0.15000 -0.62000L0.15000 -0.61000M-0.15000 -0.60000L-0.15000 -0.61000M0.15000 -0.61000L0.15000 -0.60000M-0.15000 -0.59000L-0.15000 -0.60000M0.15000 -0.60000L0.15000 -0.59000M-0.15000 -0.58000L-0.15000 -0.59000M0.15000 -0.59000L0.15000 -0.58000M-0.15000 -0.57000L-0.15000 -0.58000M0.15000 -0.58000L0.15000 -0.57000M-0.15000 -0.56000L-0.15000 -0.57000M0.15000 -0.57000L0.15000 -0.56000M-0.15000 -0.55000L-0.15000 -0.56000M0.15000 -0.56000L0.15000 -0.55000M-0.15000 -0.54000L-0.15000 -0.55000M0.15000 -0.55000L0.15000 -0.54000M-0.15000 -0.53000L-0.15000 -0.54000M0.15000 -0.54000L0.15000 -0.53000M-0.15000 -0.52000L-0.15000 -0.53000M0.15000 -0.53000L0.15000 -0.52000M-0.15000 -0.51000L-0.15000 -0.52000M0.15000 -0.52000L0.15000 -0.51000M-0.15000 -0.50000L-0.15000 -0.51000M0.15000 -0.51000L0.15000 -0.50000M-0.15000 -0.49000L-0.15000 -0.50000M0.15000 -0.50000L0.15000 -0.49000M-0.15000 -0.48000L-0.15000 -0.49000M0.15000 -0.49000L0.15000 -0.48000M-0.15000 -0.47000L-0.15000 -0.48000M0.15000 -0.48000L0.15000 -0.47000M-0.15000 -0.46000L-0.15000 -0.47000M0.15000 -0.47000L0.15000 -0.46000M-0.15000 -0.45000L-0.15000 -0.46000M0.15000 -0.46000L0.15000 -0.45000M-0.15000 -0.44000L-0.15000 -0.45000M0.15000 -0.45000L0.15000 -0.44000M-0.15000 -0.43000L-0.15000 -0.44000M0.15000 -0.44000L0.15000 -0.43000M-0.15000 -0.42000L-0.15000 -0.43000M0.15000 -0.43000L0.15000 -0.42000M-0.15000 -0.41000L-0.15000 -0.42000M0.15000 -0.42000L0.15000 -0.41000M-0.15000 -0.40000L-0.15000 -0.41000M0.15000 -0.41000L0.15000 -0.40000M-0.15000 -0.39000L-0.15000 -0.40000M0.15000 -0.40000L0.15000 -0.39000M-0.15000 -0.38000L-0.15000 -0.39000M0.15000 -0.39000L0.15000 -0.38000M-0.15000 -0.37000L-0.15000 -0.38000M0.15000 -0.38000L0.15000 -0.37000M-0.15000 -0.36000L-0.15000 -0.37000M0.15000 -0.37000L0.15000 -0.36000M-0.15000 -0.35000L-0.15000 -0.36000M0.15000 -0.36000L0.15000 -0.35000M-0.15000 -0.34000L-0.15000 -0.35000M0.15000 -0.35000L0.15000 -0.34000M-0.15000 -0.33000L-0.15000 -0.34000M0.1500